<?xml version="1.0"?> 
<telemoveis xmlns="http://www.example.org/telemoveis" 
xmlns:xsi="http://www.w3.org/2001/XMLSchema-instance"
xsi:schemaLocation="http://www.example.org/telemoveis telemoveis.xsd">
        <Telemovel>
            <marca>Iphone</marca>
            <nome>11</nome>
            <ecra>5</ecra>
            <ram>12</ram>
            <armazenamento>256</armazenamento>
            <camara>2</camara>
            <resolucao>64</resolucao>
            <bateria>4000</bateria>
            <preco>800.00</preco>
        </Telemovel>
        <Telemovel>
            <marca>Iphone</marca>
            <nome>11 Pro</nome>
            <ecra>6</ecra>
            <ram>16</ram>
            <armazenamento>256</armazenamento>
            <camara>3</camara>
            <resolucao>64</resolucao>
            <bateria>5500</bateria>
            <preco>1000.00</preco>
        </Telemovel>
        <Telemovel>
            <marca>Iphone</marca>
            <nome>12</nome>
            <ecra>5.5</ecra>
            <ram>16</ram>
            <armazenamento>512</armazenamento>
            <camara>3</camara>
            <resolucao>64</resolucao>
            <bateria>6000</bateria>
            <preco>1200.00</preco>
        </Telemovel>
        <Telemovel>
            <marca>Xiaomi</marca>
            <nome>Redmi</nome>
            <ecra>7.2</ecra>
            <ram>16</ram>
            <armazenamento>512</armazenamento>
            <camara>1</camara>
            <resolucao>64</resolucao>
            <bateria>3000</bateria>
            <preco>250.00</preco>
        </Telemovel>
        <Telemovel>
            <marca>Huawey</marca>
            <nome>P3</nome>
            <ecra>6.3</ecra>
            <ram>16</ram>
            <armazenamento>512</armazenamento>
            <camara>2</camara>
            <resolucao>64</resolucao>
            <bateria>4500</bateria>
            <preco>120.00</preco>
        </Telemovel>
</telemoveis>  